uid,namedLocation,plotID,collectDate,identifiedDate,sampleID,subsampleID,scientificName,acceptedTaxonID,taxonRank,family,subfamily,tribe,subtribe,genus,subgenus,specificEpithet,infraspecificEpithet,identificationQualifier,identificationReferences,identificationProtocolVersion,identificationHistoryID,scientificNameAuthorship,sexOrAge,individualCount,sampleCondition,archiveMedium,archiveFacilityID,deprecatedVialID,identifiedBy,laboratoryName,remarks
"e6516a62-9677-4918-ab43-e514fbe55876","KONZ_007.tickPlot.tck","KONZ_007","2019-05-14T15:06Z","2020-01-05T17:00Z","KONZ_007.20190514","KONZ_007.20190514.DERVAR.F","Dermacentor variabilis","DERVAR","species","Ixodidae",,,,"Dermacentor",,"variabilis",,,"Keirans, J. E., and T. R. Litwak. 1989. Pictorial key to the adults of hard ticks, family Ixodidae (Ixodida: Ixodoidea), east of the Mississippi River. Journal of Medical Entomology, 26(5):435-448.","GSU_tickIdentification_SOP_2016-11-01.pdf",,"Say","Female",1,"OK","95% ethanol","USNMENT1512011",,"L. Beati","Georgia Southern University",
"8828112b-5348-4444-b0f4-403f13d3791e","KONZ_001.tickPlot.tck","KONZ_001","2019-05-14T15:41Z","2020-01-05T17:00Z","KONZ_001.20190514","KONZ_001.20190514.AMBAME.N","Amblyomma americanum","AMBAME","species","Ixodidae",,,,"Amblyomma",,"americanum",,,"Keirans, J. E., and L. A. Durden. 1998. Illustrated Key to Nymphs of the Tick Genus Amblyomma (Acari: Ixodidae) Found in the United States. Journal of Medical Entomology, 35:489–495.","GSU_tickIdentification_SOP_2016-11-01.pdf",,"Linnaeus","Nymph",1,"OK","95% ethanol","USNMENT1512016",,"L. Beati","Georgia Southern University",
"2d5b0e16-b7f9-470a-95a5-2dc7af4bbcaa","KONZ_025.tickPlot.tck","KONZ_025","2019-05-14T16:31Z","2020-01-05T17:00Z","KONZ_025.20190514","KONZ_025.20190514.AMBAME.N","Amblyomma americanum","AMBAME","species","Ixodidae",,,,"Amblyomma",,"americanum",,,"Keirans, J. E., and L. A. Durden. 1998. Illustrated Key to Nymphs of the Tick Genus Amblyomma (Acari: Ixodidae) Found in the United States. Journal of Medical Entomology, 35:489–495.","GSU_tickIdentification_SOP_2016-11-01.pdf",,"Linnaeus","Nymph",7,"OK","95% ethanol","USNMENT1512034",,"L. Beati","Georgia Southern University",
"fee47ad5-aa19-477f-bfbc-1554ffb19762","KONZ_025.tickPlot.tck","KONZ_025","2019-05-14T16:31Z","2020-01-05T17:00Z","KONZ_025.20190514","KONZ_025.20190514.AMBAME.F","Amblyomma americanum","AMBAME","species","Ixodidae",,,,"Amblyomma",,"americanum",,,"Cooley, R. A. and G. M. Kohls. 1944. The genus Amblyomma (ixodidae) in the United States. The Journal of Parasitology, 30(2):77-111.","GSU_tickIdentification_SOP_2016-11-01.pdf",,"Linnaeus","Female",4,"OK","95% ethanol","USNMENT1512012",,"L. Beati","Georgia Southern University",
"be17ca16-68f3-405f-b439-91f599657aac","KONZ_025.tickPlot.tck","KONZ_025","2019-05-14T16:31Z","2020-01-05T17:00Z","KONZ_025.20190514","KONZ_025.20190514.AMBAME.M","Amblyomma americanum","AMBAME","species","Ixodidae",,,,"Amblyomma",,"americanum",,,"Cooley, R. A. and G. M. Kohls. 1944. The genus Amblyomma (ixodidae) in the United States. The Journal of Parasitology, 30(2):77-111.","GSU_tickIdentification_SOP_2016-11-01.pdf",,"Linnaeus","Male",8,"OK","95% ethanol","USNMENT1512032",,"L. Beati","Georgia Southern University",
