uid,namedLocation,plotID,collectDate,identifiedDate,sampleID,subsampleID,scientificName,acceptedTaxonID,taxonRank,family,subfamily,tribe,subtribe,genus,subgenus,specificEpithet,infraspecificEpithet,identificationQualifier,identificationReferences,identificationProtocolVersion,identificationHistoryID,scientificNameAuthorship,sexOrAge,individualCount,sampleCondition,archiveMedium,archiveFacilityID,deprecatedVialID,identifiedBy,laboratoryName,remarks
"b7ce37fd-65c8-49f5-8468-eb972e5309e4","WOOD_001.tickPlot.tck","WOOD_001","2019-05-09T16:51Z","2019-12-04T17:00Z","WOOD_001.20190509","WOOD_001.20190509.DERVAR.F","Dermacentor variabilis","DERVAR","species","Ixodidae",,,,"Dermacentor",,"variabilis",,,"Other (described in remarks)","GSU_tickIdentification_SOP_2016-11-01.pdf",,"Say","Female",1,"OK","95% ethanol","USNMENT986075",,"L. Beati","Georgia Southern University",
"5a6706c8-6c6d-4fbb-b208-f49c8ea41968","WOOD_007.tickPlot.tck","WOOD_007","2019-05-09T17:51Z","2019-12-04T17:00Z","WOOD_007.20190509","WOOD_007.20190509.DERVAR.M","Dermacentor variabilis","DERVAR","species","Ixodidae",,,,"Dermacentor",,"variabilis",,,"Yunker, C. E., Keirans, J. E., Clifford, C. M., and E. R. Easton. 1986. Dermacentor ticks (Acari: Ixodoidea: Ixodidae) of the New World: a scanning electron microscope atlas. Proceedings of the Entomological Society of Washington, 88(4):609-627.","GSU_tickIdentification_SOP_2016-11-01.pdf",,"Say","Male",1,"OK","95% ethanol","USNMENT986081",,"L. Beati","Georgia Southern University",
"71af092e-0393-4e5c-8681-706dbe4fc551","WOOD_001.tickPlot.tck","WOOD_001","2019-05-30T14:38Z","2019-12-04T17:00Z","WOOD_001.20190530","WOOD_001.20190530.DERVAR.F","Dermacentor variabilis","DERVAR","species","Ixodidae",,,,"Dermacentor",,"variabilis",,,"Cooley, R. A. 1938. The genera Dermacentor and Otocentor (Ixodidae) in the United States, with studies in variation. US Government Printing Office.","GSU_tickIdentification_SOP_2016-11-01.pdf",,"Say","Female",2,"OK","95% ethanol","USNMENT986086",,"L. Beati","Georgia Southern University",
"4d2c42d9-9c5f-4f11-8d9d-58586c516844","WOOD_007.tickPlot.tck","WOOD_007","2019-05-30T15:34Z","2019-12-04T17:00Z","WOOD_007.20190530","WOOD_007.20190530.DERVAR.M","Dermacentor variabilis","DERVAR","species","Ixodidae",,,,"Dermacentor",,"variabilis",,,"Other (described in remarks)","GSU_tickIdentification_SOP_2016-11-01.pdf",,"Say","Male",1,"OK","95% ethanol","USNMENT986065",,"L. Beati","Georgia Southern University",
"00e78c8e-8f3d-4b17-901f-d7cdc7ffcaef","WOOD_006.tickPlot.tck","WOOD_006","2019-05-30T16:17Z","2019-12-04T17:00Z","WOOD_006.20190530","WOOD_006.20190530.DERVAR.M","Dermacentor variabilis","DERVAR","species","Ixodidae",,,,"Dermacentor",,"variabilis",,,"Keirans, J. E., and T. R. Litwak. 1989. Pictorial key to the adults of hard ticks, family Ixodidae (Ixodida: Ixodoidea), east of the Mississippi River. Journal of Medical Entomology, 26(5):435-448.","GSU_tickIdentification_SOP_2016-11-01.pdf",,"Say","Male",1,"OK","95% ethanol","USNMENT986078",,"L. Beati","Georgia Southern University",
"dc05dfd2-f45d-4563-a803-9facd18d8958","WOOD_006.tickPlot.tck","WOOD_006","2019-05-30T16:17Z","2019-12-04T17:00Z","WOOD_006.20190530","WOOD_006.20190530.DERVAR.F","Dermacentor variabilis","DERVAR","species","Ixodidae",,,,"Dermacentor",,"variabilis",,,"Keirans, J. E., and C. M. Clifford. 1978. The genus Ixodes in the United States: a scanning electron microscope study and key to the adults. Journal of Medical Entomology, 15(Supplement 2):1-38.","GSU_tickIdentification_SOP_2016-11-01.pdf",,"Say","Female",1,"OK","95% ethanol","USNMENT986079",,"L. Beati","Georgia Southern University",
"cbdb9146-c45f-4273-9805-52693cfcc3e6","WOOD_002.tickPlot.tck","WOOD_002","2019-05-30T17:18Z","2019-12-04T17:00Z","WOOD_002.20190530","WOOD_002.20190530.DERVAR.F","Dermacentor variabilis","DERVAR","species","Ixodidae",,,,"Dermacentor",,"variabilis",,,"Cooley, R. A. and G. M. Kohls. 1945. The genus Ixodes in North America. National Institute of Health Bulletin, 184.","GSU_tickIdentification_SOP_2016-11-01.pdf",,"Say","Female",1,"OK","95% ethanol","USNMENT986068",,"L. Beati","Georgia Southern University",
"a8c1e1ac-a5a4-4f35-a868-1f62bd9d9086","WOOD_009.tickPlot.tck","WOOD_009","2019-05-30T17:57Z","2019-12-04T17:00Z","WOOD_009.20190530","WOOD_009.20190530.DERVAR.F","Dermacentor variabilis","DERVAR","species","Ixodidae",,,,"Dermacentor",,"variabilis",,,"Keirans, J. E., and L. A. Durden. 1998. Illustrated Key to Nymphs of the Tick Genus Amblyomma (Acari: Ixodidae) Found in the United States. Journal of Medical Entomology, 35:489–495.","GSU_tickIdentification_SOP_2016-11-01.pdf",,"Say","Female",2,"OK","95% ethanol","USNMENT986061",,"L. Beati","Georgia Southern University",
"418bd677-9ca6-4f26-a0ed-36caa2d19839","WOOD_024.tickPlot.tck","WOOD_024","2019-05-30T18:47Z","2019-12-04T17:00Z","WOOD_024.20190530","WOOD_024.20190530.DERVAR.F","Dermacentor variabilis","DERVAR","species","Ixodidae",,,,"Dermacentor",,"variabilis",,,"Other (described in remarks)","GSU_tickIdentification_SOP_2016-11-01.pdf",,"Say","Female",1,"OK","95% ethanol","USNMENT986080",,"L. Beati","Georgia Southern University",
