uid,namedLocation,plotID,collectDate,identifiedDate,sampleID,subsampleID,scientificName,acceptedTaxonID,taxonRank,family,subfamily,tribe,subtribe,genus,subgenus,specificEpithet,infraspecificEpithet,identificationQualifier,identificationReferences,identificationProtocolVersion,identificationHistoryID,scientificNameAuthorship,sexOrAge,individualCount,sampleCondition,archiveMedium,archiveFacilityID,deprecatedVialID,identifiedBy,laboratoryName,remarks
"a3bef6ad-a884-4599-9b18-c8c534de1fc8","ORNL_008.tickPlot.tck","ORNL_008","2025-04-09T13:52Z","2025-06-04T16:00Z","ORNL_008.20250409","ORNL_008.20250409.AMBAME.N","Amblyomma americanum","AMBAME","species","Ixodidae",,,,"Amblyomma",,"americanum",,,"Keirans, J. E., and L. A. Durden. 1998. Illustrated Key to Nymphs of the Tick Genus Amblyomma (Acari: Ixodidae) Found in the United States. Journal of Medical Entomology, 35:489–495.","NEON Tick Identification SOP 1.0_NEON Final_20241030.pdf",,"Linnaeus","Nymph",1,"OK","95% ethanol",,,"Guang Xu","University of Massachusetts Laboratory of Medical Zoology",
"00162ef6-89ba-419f-8830-baf39155d2a4","ORNL_002.tickPlot.tck","ORNL_002","2025-04-09T13:59Z","2025-06-04T16:00Z","ORNL_002.20250409","ORNL_002.20250409.IXOSCA.F","Ixodes scapularis","IXOSCA","species","Ixodidae",,,,"Ixodes",,"scapularis",,,"Keirans, J. E., and C. M. Clifford. 1978. The genus Ixodes in the United States: a scanning electron microscope study and key to the adults. Journal of Medical Entomology, 15(Supplement 2):1-38.","NEON Tick Identification SOP 1.0_NEON Final_20241030.pdf",,"Say","Female",1,"OK","95% ethanol",,,"Guang Xu","University of Massachusetts Laboratory of Medical Zoology",
"66a17eec-3026-480a-ae8d-09daafc632d8","ORNL_003.tickPlot.tck","ORNL_003","2025-04-09T15:31Z","2025-06-04T16:00Z","ORNL_003.20250409","ORNL_003.20250409.IXOSCA.F","Ixodes scapularis","IXOSCA","species","Ixodidae",,,,"Ixodes",,"scapularis",,,"Keirans, J. E., and C. M. Clifford. 1978. The genus Ixodes in the United States: a scanning electron microscope study and key to the adults. Journal of Medical Entomology, 15(Supplement 2):1-38.","NEON Tick Identification SOP 1.0_NEON Final_20241030.pdf",,"Say","Female",1,"OK","95% ethanol",,,"Guang Xu","University of Massachusetts Laboratory of Medical Zoology",
"ccd3d883-9986-49d8-8719-b4e321fbd6ec","ORNL_003.tickPlot.tck","ORNL_003","2025-04-09T15:31Z","2025-06-04T16:00Z","ORNL_003.20250409","ORNL_003.20250409.AMBAME.M","Amblyomma americanum","AMBAME","species","Ixodidae",,,,"Amblyomma",,"americanum",,,"Cooley, R. A. and G. M. Kohls. 1944. The genus Amblyomma (ixodidae) in the United States. The Journal of Parasitology, 30(2):77-111.","NEON Tick Identification SOP 1.0_NEON Final_20241030.pdf",,"Linnaeus","Male",1,"OK","95% ethanol",,,"Guang Xu","University of Massachusetts Laboratory of Medical Zoology",
"e40f2804-68ce-4632-9ca4-e474c709d51a","ORNL_040.tickPlot.tck","ORNL_040","2025-04-09T18:43Z","2025-06-04T16:00Z","ORNL_040.20250409","ORNL_040.20250409.AMBAME.N","Amblyomma americanum","AMBAME","species","Ixodidae",,,,"Amblyomma",,"americanum",,,"Keirans, J. E., and L. A. Durden. 1998. Illustrated Key to Nymphs of the Tick Genus Amblyomma (Acari: Ixodidae) Found in the United States. Journal of Medical Entomology, 35:489–495.","NEON Tick Identification SOP 1.0_NEON Final_20241030.pdf",,"Linnaeus","Nymph",3,"OK","95% ethanol",,,"Guang Xu","University of Massachusetts Laboratory of Medical Zoology",
