uid,namedLocation,plotID,collectDate,identifiedDate,sampleID,subsampleID,scientificName,acceptedTaxonID,taxonRank,family,subfamily,tribe,subtribe,genus,subgenus,specificEpithet,infraspecificEpithet,identificationQualifier,identificationReferences,identificationProtocolVersion,identificationHistoryID,scientificNameAuthorship,sexOrAge,individualCount,sampleCondition,archiveMedium,archiveFacilityID,deprecatedVialID,identifiedBy,laboratoryName,remarks
"a4e66ca2-32e8-4500-8bd4-d40293ebc61a","TREE_005.tickPlot.tck","TREE_005","2020-06-12T18:40Z","2020-12-08T17:00Z","TREE_005.20200612","TREE_005.20200612.IXOSCA.M","Ixodes scapularis","IXOSCA","species","Ixodidae",,,,"Ixodes",,"scapularis",,,"Cooley, R. A. and G. M. Kohls. 1945. The genus Ixodes in North America. National Institute of Health Bulletin, 184.","GSU_tickIdentification_SOP_2016-11-01.pdf",,"Say","Male",1,"OK","95% ethanol","USNMENT1512830",,"L. Beati","Georgia Southern University",
"d2326c63-0636-4655-b5f1-fee93cbf5440","TREE_005.tickPlot.tck","TREE_005","2020-06-12T18:40Z","2020-12-08T17:00Z","TREE_005.20200612","TREE_005.20200612.DERVAR.M","Dermacentor variabilis","DERVAR","species","Ixodidae",,,,"Dermacentor",,"variabilis",,,"Cooley, R. A. 1938. The genera Dermacentor and Otocentor (Ixodidae) in the United States, with studies in variation. US Government Printing Office.","GSU_tickIdentification_SOP_2016-11-01.pdf",,"Say","Male",2,"OK","95% ethanol","USNMENT1512721",,"L. Beati","Georgia Southern University",
"7536806f-4415-431b-8758-ffa368ed0359","TREE_005.tickPlot.tck","TREE_005","2020-06-12T18:40Z","2020-12-08T17:00Z","TREE_005.20200612","TREE_005.20200612.DERVAR.F","Dermacentor variabilis","DERVAR","species","Ixodidae",,,,"Dermacentor",,"variabilis",,,"Cooley, R. A. 1938. The genera Dermacentor and Otocentor (Ixodidae) in the United States, with studies in variation. US Government Printing Office.","GSU_tickIdentification_SOP_2016-11-01.pdf",,"Say","Female",2,"OK","95% ethanol","USNMENT1512824",,"L. Beati","Georgia Southern University",
"49280c20-c1e5-4f37-be09-5c7318c12230","TREE_007.tickPlot.tck","TREE_007","2020-06-12T18:44Z","2020-12-08T17:00Z","TREE_007.20200612","TREE_007.20200612.IXOSCA.N","Ixodes scapularis","IXOSCA","species","Ixodidae",,,,"Ixodes",,"scapularis",,,"Durden, L.A. & Keirans, J.E. (1996). Nymphs of the genus Ixodes (Acari: Ixodidae) in the US. Taxonomy, ID Key, Distribution, Hosts, and Medical/Veterinary Importance. Thomas Say Publications in Entomology: Monographs. Entomological Society of America.","GSU_tickIdentification_SOP_2016-11-01.pdf",,"Say","Nymph",4,"OK","95% ethanol","USNMENT1512808",,"L. Beati","Georgia Southern University",
"eacb3178-ce41-417e-811a-09e30194cde8","TREE_007.tickPlot.tck","TREE_007","2020-06-12T18:44Z","2020-12-08T17:00Z","TREE_007.20200612","TREE_007.20200612.IXOSP.L","Ixodidae sp.","IXOSP","family","Ixodidae",,,,,,"sp.",,,,"GSU_tickIdentification_SOP_2016-11-01.pdf",,,"Larva",41,"OK","95% ethanol","USNMENT1512809",,"L. Beati","Georgia Southern University",
"65c37139-e492-4ec4-8bfb-2e95807e8633","TREE_015.tickPlot.tck","TREE_015","2020-06-12T20:56Z","2020-12-08T17:00Z","TREE_015.20200612","TREE_015.20200612.IXOSCA.N","Ixodes scapularis","IXOSCA","species","Ixodidae",,,,"Ixodes",,"scapularis",,,"Durden, L.A. & Keirans, J.E. (1996). Nymphs of the genus Ixodes (Acari: Ixodidae) in the US. Taxonomy, ID Key, Distribution, Hosts, and Medical/Veterinary Importance. Thomas Say Publications in Entomology: Monographs. Entomological Society of America.","GSU_tickIdentification_SOP_2016-11-01.pdf",,"Say","Nymph",1,"OK","95% ethanol","USNMENT1512789",,"L. Beati","Georgia Southern University",
